Rottweiler or Rottie,"APPEARANCE The Rottweiler is a large dog, slightly longer than it is tall with a large frame balanced by a deep, broad chest and heavy muscling. Rotties are always black with clearly delineated rust or mahogany markings over the eyes, on the side of the muzzle, and on throat, chest, and lower legs. Traditionally tail docking was performed when the puppies were newly born within days but this practice has now thankfully been outlawed in Australia. The Rottie coat is smooth and short with an undercoat present on the neck and thighs. Wavy or curly coats are faulted and long coats are disqualifications for breeding and the show ring. The Rottweiler in motion is a picture of power and stamina with strong reach in front and forceful drive in the rear. A well-conditioned Rottie is a superb athlete. Height: Males 61-68cm; Females 56-63cm Weight: 42-50 Kg For the full breed standard, please visit the ANKC website .","TEMPERAMENT It is in breed temperament that the Rottie is often misjudged. A well-bred Rottweiler is calm, confident, and courageous with an inherent aloofness towards strangers and a reserved attitude in new situations. Combined with his fierce devotion to home and family, these characteristics can be subverted from their original purpose by poor breeding practices, lack of socialisation, and failure to teach basic good manners. Rottweilers are territorial and will not permit strangers onto their property or in their home unless their owner welcomes the person. Some Rottweilers will not even let people they know into the house if the owner isn’t there, which can be a problem if you need to have a pet sitter or some other person come in while you are gone. If the dog does not accept examination by the owner or by anyone chosen by the owner, such as a veterinarian, without either shrinking away or becoming aggressive, the dog does not exhibit acceptable Rottweiler character. Rottweiler owners without a strong grasp of the breed’s nature can find themselves in trouble if the dog has been badly bred or assumes leadership of the family.","HEALTH & LIFESPAN Rottweilers are one of the breeds most affected by Hip Dysplasia , a genetic deformity in which the head of the femur doesn’t fit properly into the hip socket. This condition can range from mild to severe. Severe cases are extremely painful and often require surgery to correct. Even with the surgery, the dog is likely to develop arthritis as he ages. Elbow Dysplasia and osteochondrosis (OCD) – a bone and cartilage problem – can also occur in this breed. Rottweilers can develop progressive retinal atrophy (PRA), cataracts, eyelid deformities, and other vision and eye problems. Rottweilers can develop heart problems , including cardiomyopathy and subaortic stenosis (SAS), a narrowing of the aorta that carries blood away from the heart. This usually shows up first as a slight heart murmur, but murmurs can often occur in puppies who have no heart problems as adults. SAS can lead to sudden death, even at a young age, so have your dog’s heart checked regularly. Rotties are also more susceptible than many breeds to canine bloat , a condition in which the stomach can turn and block, causing a build-up of gas. Unless treated very quickly, bloat can be fatal. Hip and elbow dysplasia are genetically carried malformations. Retinal problems are inherited, as is the tendency to bloat. Rottweilers are sensitive to high temperatures . Never leave any dog outdoors on a hot day without access to shade and an unlimited supply of fresh water.",not available,not available,not available,"GROOMING The Rottweiler has what’s called a double coat. The medium-length outer coat is straight, coarse and dense, lying flat on the body. The soft, downy undercoat is present on the neck and thighs, and its thickness depends on whether you live in a cool or warm climate. The Rottweiler’s coat sheds moderately and requires little grooming. Brush him weekly with a rubber hound mitt or soft bristle brush to keep the hair and skin healthy. In spring and fall, he will have a heavy shed, known as “blowing out” the coat and will need to be brushed more frequently to get rid of all the loose hair. With the gentle dog shampoos available now, you can bathe your Rottie weekly without harming his coat or only when he gets dirty. Clean the ears as needed with a solution recommended by your veterinarian. Wipe out the ear with a cotton ball, never going deeper than the first knuckle of your finger. Trim the nails regularly, usually every couple of weeks. They should never be so long that they click on the floor. And don't forget to brush the teeth frequently with a specific pet toothpaste.",
Samoyed,"APPEARANCE The Samoyed is medium-size dog with a thick white coat and a big, permanent smile on his face that reflects the happy-go-lucky nature of the breed. The Samoyed is actually a rugged, compact working dog of both dignity and grace. He is a double-coated breed with a softer undercoat and a harsher standoffish outer coat. The Samoyed coat can be white, cream or biscuit or a combination of any of the three. Any colour other than listed or blue eyes are faults in the Samoyed. The Samoyed is, in spite of what you may have heard, a breed that does well in all elements.  While they prefer the cooler climates; the Samoyed acclimatises well to the warmer climates.  Their dual coat protects them in both cold and heat. You will just need to  use the common sense approach as it applies to the heat and humidity factors.  The Samoyed is less active during the summer months and will want to go outside in the summer months in the very early morning. Males are noticeably larger than females. Females are 45-51cm at the shoulder, the males are 51-56cm. Their weight is in proportion to the size. The Samoyed being essentially a working dog , he should be strong, active and graceful. As his work lies in cold climates his coat should be heavy and weather-resisting. For the full breed standard, please visit the ANKC website .","TEMPERAMENT Samoyeds are active, inquisitive, quick-witted and mischievous.  They remain playful through to old age.  With a twinkle in their dark, intelligent eyes and their ever present  smile, the Samoyed has been called the dog that carries in its face and heart the spirit of Christmas the whole year through. The Samoyed is alert, full of action but above all displaying affection towards all mankind. The Samoyed has often been accused of being wilful and stubborn, and certainly he can be easily bored and distracted. However, his original environment demanded a very intelligent breed with an independent nature. He is easy to train, but dislikes repetition. He thinks for himself, and ""if you keep throwing that ball away, you obviously don't want it!"" If not kept entertained, the Samoyed will entertain himself - he enjoys chewing and delights in ""gardening"". At the very least, a Samoyed requires daily walking. Samoyeds are naturals when it comes to dog sports, and will thrive on the stimulation and adrenaline rush of activities like obedience training and agility . There is also a dog sledding competition held annually during winter. Breeders warn that without the stimulation of daily exercise and people contact, the Samoyed will become a shadow of its true self and will fall into a depressed state.  This can lead to unruly behaviour, as well as a tendency to escape from the yard.  As with all dogs, early socialisation and training is a must with the Samoyed to ensure it develops good social skills. Many Samoyeds are barkers, which makes them great as watchdogs, but as guard dogs, they are often found lacking - they will bark when a stranger approaches, but then show him where to find the silverware. The constant companionship with man through the years, has given the Samoyed an uncanny human understanding.  His guarding of reindeer, requiring always a protector, never a killer, has developed a disposition in the breed unique in the canine world. A Samoyed is totally trustworthy with children and develops a close affinity with humans. Due to their exuberance with children’s games, supervision is strongly advised with toddlers to prevent accidental knocking. A Samoyed’s main objective in life is to sleep by his owners. He needs to be an integral part of your family . They are a human-oriented breed, and want to be with their people inside or where ever their people happen to be at any given time.  The affectionate Samoyed will be your friend for life!  If you are looking for a dog to put out in the backyard to greet as time permits, you are looking into the wrong breed. An ignored Sammie equals a bored Sammie resulting in behavioural problems.","HEALTH Like all breeds there may be some health issues, like hip dysplasia, PRA, RD/OSD, cardiac and eye disease. Some dogs may be faced with these health challenges in their lives, but the majority of Samoyeds are healthy dogs. The Samoyed is a medium dog breed and has a lifespan of 12 to 14 years.",not available,not available,not available,"GROOMING His magnificent white coat has two layers, a dense, woolly undercoat, which is typically shed out once a year, and a silver-tipped harsh outer coat of long, straight guard hairs.  Grooming this lovely coat can be a pleasure, or a chore, for both dog and owner. Surprisingly, that glamorous coat stays fairly clean and requires far less grooming than most people expect. Weekly brushing is usually enough and mud sheds easily when dry. Little bathing is required and there is none of the ""doggy odour"" often found in other breeds. As a side benefit of the thick white coat, the Samoyed readily adapts to climate extremes - both cold and hot. However, the coat will eventually ""blow"" - once or twice a year the undercoat sheds in a spectacular way requiring many hours work with a stripping comb. A Samoyed will only smell if ill (normally from hormonal imbalance or gastric upsets) or if the under coast is left wet for long periods of time. For this reason when washing a Samoyed it is important to dry the thick under coat as quickly as possible, investment into a strong hair dryer or dog blower with a good supply of talcum powder is a great investment when owning a Samoyed.",
Schnauzer,not available,,not available,not available,not available,not available,not available,not available
Shetland Sheepdog,"APPEARANCE It is understandable how the Sheltie is often mistaken for a Collie pup. Shelties are in fact quite small, standing around 37 centimetres tall at the withers, around half the size of a Collie. Though small, Shelties are regarded by their owners as a breed of great beauty. The refined appearance of the breed is accentuated by the elegant head and a mane-like frill of abundant, long hair which envelops the shoulders and chest. The most common colours in Australia are sable, ranging from a pale gold to deep chocolate with white trimmings; a tri-colour of black with tan and white points; and the blue merle, blue with tan and white points. Other colours less often seen are the bi-colours of blue with white points or black with white points. For the full breed standard, please visit the ANKC page","TEMPERAMENT Shelties are an intelligent breed and very responsive to training. Though loyal to their owners, Shelties are known to be timid and wary of strangers if not encouraged to socialise. Once settled, a Sheltie puppy will quickly consider itself a member of the family and will happily follow its owners around all day. Because of their adeptness to training, many Shelties in Australia excel in dog activities such as the show ring, tracking, flyball , agility and of course obedience. Exceptionally attentive and responsive, Shetland Sheepdogs are easy to train if you have a calm voice and a light hand on the leash. Sensitivity is one of the hallmarks of this breed. Often they need only verbal corrections, and they wilt or become defensive if you jerk them around. Praise, gentle guidance, and food rewards are the way to go with Shelties. More importantly, Shelties need ""mental exercise."" These bright dogs cannot just sit in the backyard and do nothing. To be happy and well-behaved, they require mental stimulation such as advanced obedience, agility , herding, or challenging games you play with them, even if it's just fetching balls and finding hidden toys. These dogs have quick reflexes, which can make them overly reactive to loud noises and sudden touches. Indeed, quite a few individuals are highstrung, startle easily, and do not do well in an environment with frequent tension, loud voices, or too much rough-housing. Most Shelties have a soft, sweet temperament. They're peaceful with other animals and polite with everyone, though typically reserved and sometimes timid with strangers. To build a confident temperament, the Shetland Sheepdog needs more extensive socialisation than many other breeds. Shelties become unhappy when left for long periods of time without companionship, and unhappiness can translate to neurotic behaviors, destructive chewing, or chronic barking. The major behavioural issue with Shelties can be excessive barking , and some individuals have high-pitched, piercing voices.","HEALTH & LIFESPAN The Shetland Sheepdog is generally regarded as a sound breed so expect your four-legged companion to be around for 12-16 years. However miniaturisation has brought with it some health concerns, particulary inherited eye conditions such as Collie Eye Anomaly and Progressive Retina Atrophy , both of which can lead to blindness. Diligent Australian breeders do test for these conditions, as well as Hip Dysplasia , so they should not be evident in most progeny. Ask the breeder for confirmation that their dogs have been tested. Keep in mind that Shelties are also prone to getting quite fat, so watch how much (and what) you feed. Finally, don’t forget regular oral care from a very early age to avoid concerns.",not available,not available,not available,GROOMING,
Siberian Husky,"The Siberian Husky is an arctic breed with striking blue or brown eyes – or one eye of each colour. The skull is medium sized and should be proportionate to the body, slightly rounded on top and tapering from the eyes forward. The muzzle is medium length and with, tapering gradually to the tip which is neither completely round nor completely square. The nose is black for gray, tan or black dogs, liver in cooper dogs, and can be flesh-coloured in white dogs. Some dogs have a nose that has pink streaks, referred to as “snow nose.” The ears sit high atop the head, are triangular in shape with slightly rounded tips that should point straight up in the air. The back is long and straight. Siberian Husky - Photo Credit: Asryn Kennel The Husky's tail is covered in thick fur and is fox-brushed shape. It is carried over the back in a sickle curve when the dog is alert, and trails when the dog is relaxed. The coat comes in many colours including various shades of gray and silver, sand, red, and black-and-white, often with striking markings on the head that are not found in other breeds. Height: Male: 54–60 cm; Female: 50–56 cm Weight: Male: 20–27 kg; Female: 16–23 kg For the full breed standard, please visit the ANKC website .","The Siberian Husky has a delightful temperament, affectionate but not fawning. This gentle and friendly disposition may be a heritage from the past, since the Chukchi people held their dogs in great esteem, housed them in the family shelters, and encouraged their children to play with them. The Siberian Husky is alert, eager to please, and adaptable. Their intelligence has been proven, but their independent spirit may at times challenge your ingenuity. The versatility of the Siberian Husky makes them an agreeable companion to people of all ages and varying interests. While capable of showing strong affection for their family, the Siberian huskies are not usually a one-person dog. They exhibit no fear or suspicion of strangers, and will greet guests cordially. Theirs is not the temperament of a watchdog, although a Siberian husky may unwittingly act as a deterrent to those ignorant of their true hospitable nature. A Siberian rarely barks – they prefer to whine or moan and will hold their head high and produce a beautiful howl. If the howl persists the neighbours may get upset – they are a rather vocal dog. In their interactions with unfamiliar dogs, the Siberian Husky displays friendly interest and gentlemanly decorum.  If attacked, however, they are ready and able to defend themselves. Predatory instincts in the Siberian Husky are strong. While the Siberian is normally gentle and friendly with people and other dogs, owners MUST be aware that small animals in and around the home, such as rabbits, birds, guinea pigs and cats, are potential victims of their strong predatory instinct. Chewing and digging?  Siberian huskies have been known to do their share. Bored Siberian Huskies are famous for chewing through drywall, ripping the stuffing out of sofas, and turning your yard into a moonscape of giant craters. Digging holes is a pastime that many Siberian Huskies have a special proclivity for so if you take great pride in your landscaping efforts…  Don’t buy a Siberian Husky.","HEALTH Huskies are generally healthy, but like all breeds, they can be prone to certain health conditions. Breed health concerns may include crystalline corneal opacity, epilepsy , hip dysplasia, hypothyroidism, juvenile cataracts, osteochondritis dissecans (OCD), nasal depigmentation, progressive retinal atrophy (PRA) and von Willebrand disease. The average life span of the Siberian Husky is 12 to 14 years.","HOUSEPET POTENTIAL To make sure you can safely invite a Husky into your home you will need to have: Six foot fences around your entire yard with proper latching gates.  Huskies can dig, chew, squeeze and climb their way out of even apparently secure yards, and have been known to learn to operate simple gate locks. Time during the day and especially the morning and evening to walk, play with and be a close companion to your Husky.  They are not a set-and-forget breed and need to be included in all the variety of your family’s daily life, every single day.  A family’s lack of time is the number one reason most Huskies end up in rescue. A commitment to training to bring out the best in your Husky, and manage their intelligence, exuberance, assertiveness and even affection using motivational training techniques. Lack of basic discipline is the number two reason most huskies end up in rescue. Australia's largest dry land dog sled race near Shepparton (VIC)",not available,not available,"The Siberian Husky is a comparatively easy dog to care for. They are by nature fastidiously clean and free from body odour and parasites. Once or twice a year the Siberian Husky sheds his coat, and it is then, when armed with a comb and a garbage bag, that one realizes the amazing density and profusion of the typical Siberian Husky coat. Some people feel that this periodic problem is easier to cope with than the constant shedding and renewal of many smooth-coated breeds. If you like fur all over the house and in the very air you breathe, then fine. If, however, you value neatness at all times, then… Don’t buy a Siberian Husky.",
Staffordshire Bull Terrier - Dog Breed,"Staffords are well muscled in the hindquarters with a strong tail. Coat colours are red, fawn, white, black or blue, or any of these colours with white. Any shade of brindle or brindle with white is also acceptable. Height: 36-41cm Weight: Males 13-17kg, Females 11-15kg For the full breed standard, visit the ANKC website","TEMPERAMENT The breed is very human-oriented and loyal, although they can be aggressive to other dogs. It is essential that pups between 8-18 weeks are well socialised, especially with children and other dogs. Breeders warn, too, that the friendly nature of most Staffords means they go to strangers readily and risk being stolen for use in illegal dog fights.","Some Staffords can suffer from a few hereditary diseases that can be tested by DNA as a puppy, such as Hip Dysplasia (degenerative bone disease), Luxating Patellas (slipping kneecaps) and Entropion (an eye disease), but none are common in the breed. Staffies is known to be at a higher risk from mastocytoma (mast cell tumours) than the general population of dogs.",not available,not available,not available,Staffords are happiest indoors with the family; they shed little hair and are easily house-trained. Fortnightly bathing is adequate if the dog spends most of its time indoors.,
Weimaraner,"APPEARANCE The Weimaraner is a powerful-looking dog, well-muscled for strength and stamina and deep-chested for endurance. The coat is short, smooth, sleek, and solid-coloured, ranging from mouse-gray to silver-gray, usually with lighter shades on the head and ears. The Weimaraner head is aristocratic, with muzzle and skull being the same length. Eyes must be light amber, gray, or blue-gray; ears are fairly long and are set high on the head and folded over. The nose is dark gray and the skin pink (not white or black) inside the flaps of the ears and on the lips. Weight: Male: 32-37 kg; Female: 25-32 kg Height: Male: 63-68 cm; Female: 58-63 cm For the full breed standard, please visit the ankc.org.au","TEMPERAMENT The Weimaraner is a housedog however he’s not suited to apartment living. This highly active dog needs both a large, securely fenced backyard where he can run and an active family who can provide him with the exercise and mental stimulation he needs. Weimaraner competing in Dog Agility Weimaraners need a couple of hours of exercise daily if you want to prevent recreational barking , digging and chewing. You could play fetch and other running games, take him jogging or hiking, teach him to run alongside your bicycle, or get him involved in a dog sport such as agility or flyball . In the house, a mature, well-trained Weimaraner will be your shadow, from bedroom to bathroom to kitchen to den. Weimaraners are more prone than many breeds to suffer from separation anxiety and can become destructive and ""dig"" in your carpet or sofa in an attempt to create a secure nest. Weimaraners are highly intelligent, but they're also independent thinkers. This combination can make them a challenge when it comes to training. Be consistent and firm, but gentle. Among the tricks your Weimaraner may learn are getting ice from the dispenser in the door of your refrigerator, turning on faucets, and opening gates and doors.","HEALTH Weimaraners are generally healthy, but like all breeds, they're prone to certain health conditions: Hip Dysplasia: This is an abnormality of the hip joint. It may affect one or both sides. Dogs with hip dysplasia may or may not show any clinical signs. Although the tendency toward hip dysplasia is thought to be inherited, diet, rapid growth, and environment also are thought to be contributors to the condition. Bloat or Gastric dilatation-volvulus (GDV):  This is a life-threatening condition that can affect large, deep-chested dogs, especially if they are fed one large meal a day, eat rapidly, drink large volumes of water after eating, and exercise vigorously after eating. Some think that raised feeding dishes and type of food might be a factor in causing this to happen too. It is more common among older dogs. Skin Allergies",not available,not available,not available,"GROOMING A Weimaraner is one of the easiest breeds to groom. Even when he has been running through mud, the dirt just seems to fall off him. Weekly brushing with a bristle brush should keep his coat and skin healthy. Weimaraners shed, but brushing will help keep loose hair off your clothes and furniture. Bathe when needed. He takes great pleasure in rolling in anything stinky, so this may be more often than would normally be necessary. All breeds with hanging ears are prone to ear infections. Check your Weimaraner's ears weekly and wipe them out with a cotton ball moistened with a cleanser recommended by your veterinarian. Your Weimaraner may have an ear infection if the inside of the ear smells bad, looks red or seems tender, or he frequently shakes his head or scratches at his ear.",
